KEY,FRIENDLY,NEUTRAL,AGGRESSIVE
left_behind_no_tasks_placeholder,All your left behind tasks at your display...<br>...it's empty...let's keep it that way,All your left behind tasks at your display...,All your left behind tasks at your display...<br>...perhaps you should be left behind
planned_no_tasks_placeholder,Here will be all your planned tasks...<br>...this is where your future successes take shape,Here will be all your planned tasks...,"Here will be all your planned tasks...<br>...no plans, no bitches"
index_no_tasks_placeholder,"Ready to create your first task?<br>Save the task by picking a priority, to keep things organised!",Ready to create your first task?<br>Write down your task and submit it by picking priority. Due date is optional,"Are you finally going to do something?<br>This is just todo app, no science diploma required!"
task_moved_to_planned,Feeling productive huh? Let's go!!!,"Task added to ""Planned""","Wow, you have plans?"
index_left_behind_popup,Happens. You'll finish it later,"Task added to ""Left Behind""",BOO! SHAME! *DING DING*
pussy_meter_subtitle,Changing the PM? Sorry for not being helpful,Choose how big of a pussy you are!,*spit* WEAKNESS DISGUSTS ME!

week_review_number,"Week %s Review"
week_review_results,"Well, you managed to survive through last week with %s%% of finished tasks... Not great, not terrible!"
week_review_planning,"Select tasks you want in week %s.<br>You can look back on your week and retrospect. Keep your week clean and focused!"
week_review_planned_tasks_info,Planned tasks are already selected.
week_review_did_you_know,"Hey, did you know this app is in pre-alpha?<br>You're such a trend setter!"
week_review_task_due_by, "due by %s"
week_review_task_added, added

#ALES
filter_all,All
